contest,title,english_title,rating,url
第 246 场周赛,你完成的完整对局数,The Number of Full Rounds You Have Played,1498.1542511841,https://leetcode.cn/problems/the-number-of-full-rounds-you-have-played/
第 246 场周赛,统计子岛屿,Count Sub Islands,1678.7231378948,https://leetcode.cn/problems/count-sub-islands/
第 246 场周赛,查询差绝对值的最小值,Minimum Absolute Difference Queries,2146.639581998,https://leetcode.cn/problems/minimum-absolute-difference-queries/
「微爱思扣 以 Code 会友」专场竞赛,下载插件,下载插件,-1,https://leetcode.cn/problems/Ju9Xwi/
「微爱思扣 以 Code 会友」专场竞赛,完成一半题目,完成一半题目,-1,https://leetcode.cn/problems/WqXACV/
「微爱思扣 以 Code 会友」专场竞赛,主题空间,主题空间,-1,https://leetcode.cn/problems/YesdPw/
第 245 场周赛,重新分配字符使所有字符串都相等,Redistribute Characters to Make All Strings Equal,1309.1422268153,https://leetcode.cn/problems/redistribute-characters-to-make-all-strings-equal/
第 245 场周赛,可移除字符的最大数目,Maximum Number of Removable Characters,1912.8440554296,https://leetcode.cn/problems/maximum-number-of-removable-characters/
第 245 场周赛,合并若干三元组以形成目标三元组,Merge Triplets to Form Target Triplet,1635.6879273926,https://leetcode.cn/problems/merge-triplets-to-form-target-triplet/
第 245 场周赛,最佳运动员的比拼回合,The Earliest and Latest Rounds Where Players Compete,2454.7653333657,https://leetcode.cn/problems/the-earliest-and-latest-rounds-where-players-compete/
第 54 场双周赛,检查是否区域内所有整数都被覆盖,Check if All the Integers in a Range Are Covered,1307.3797385769,https://leetcode.cn/problems/check-if-all-the-integers-in-a-range-are-covered/
第 54 场双周赛,找到需要补充粉笔的学生编号,Find the Student that Will Replace the Chalk,1355.5386161215,https://leetcode.cn/problems/find-the-student-that-will-replace-the-chalk/
第 54 场双周赛,最大的幻方,Largest Magic Square,1781.3664141686,https://leetcode.cn/problems/largest-magic-square/
第 54 场双周赛,反转表达式值的最少操作次数,Minimum Cost to Change the Final Value of Expression,2531.6452775023,https://leetcode.cn/problems/minimum-cost-to-change-the-final-value-of-expression/
第 244 场周赛,判断矩阵经轮转后是否一致,Determine Whether Matrix Can Be Obtained By Rotation,1407.0629410799,https://leetcode.cn/problems/determine-whether-matrix-can-be-obtained-by-rotation/
第 244 场周赛,使数组元素相等的减少操作次数,Reduction Operations to Make the Array Elements Equal,1427.7906804882,https://leetcode.cn/problems/reduction-operations-to-make-the-array-elements-equal/
第 244 场周赛,使二进制字符串字符交替的最少反转次数,Minimum Number of Flips to Make the Binary String Alternating,2005.5862669078,https://leetcode.cn/problems/minimum-number-of-flips-to-make-the-binary-string-alternating/
第 244 场周赛,装包裹的最小浪费空间,Minimum Space Wasted From Packaging,2214.4798747386,https://leetcode.cn/problems/minimum-space-wasted-from-packaging/
第 243 场周赛,检查某单词是否等于两单词之和,Check if Word Equals Summation of Two Words,1187.1641565458,https://leetcode.cn/problems/check-if-word-equals-summation-of-two-words/
第 243 场周赛,插入后的最大值,Maximum Value after Insertion,1381.2168789318,https://leetcode.cn/problems/maximum-value-after-insertion/
第 243 场周赛,使用服务器处理任务,Process Tasks Using Servers,1979.1112273597,https://leetcode.cn/problems/process-tasks-using-servers/
第 243 场周赛,准时抵达会议现场的最小跳过休息次数,Minimum Skips to Arrive at Meeting On Time,2587.8725248485,https://leetcode.cn/problems/minimum-skips-to-arrive-at-meeting-on-time/
第 53 场双周赛,长度为三且各字符不同的子字符串,Substrings of Size Three with Distinct Characters,1248.7224675206,https://leetcode.cn/problems/substrings-of-size-three-with-distinct-characters/
第 53 场双周赛,数组中最大数对和的最小值,Minimize Maximum Pair Sum in Array,1301.381757401,https://leetcode.cn/problems/minimize-maximum-pair-sum-in-array/
第 53 场双周赛,矩阵中最大的三个菱形和,Get Biggest Three Rhombus Sums in a Grid,1897.5516652727,https://leetcode.cn/problems/get-biggest-three-rhombus-sums-in-a-grid/
第 53 场双周赛,两个数组最小的异或值之和,Minimum XOR Sum of Two Arrays,2145.183995267,https://leetcode.cn/problems/minimum-xor-sum-of-two-arrays/
第 242 场周赛,哪种连续子字符串更长,Longer Contiguous Segments of Ones than Zeros,1204.9864820183,https://leetcode.cn/problems/longer-contiguous-segments-of-ones-than-zeros/
第 242 场周赛,准时到达的列车最小时速,Minimum Speed to Arrive on Time,1675.761234741,https://leetcode.cn/problems/minimum-speed-to-arrive-on-time/
第 242 场周赛,跳跃游戏 VII,Jump Game VII,1896.1411567598,https://leetcode.cn/problems/jump-game-vii/
第 242 场周赛,石子游戏 VIII,Stone Game VIII,2439.7337408636,https://leetcode.cn/problems/stone-game-viii/
第 241 场周赛,找出所有子集的异或总和再求和,Sum of All Subset XOR Totals,1372.1152262488,https://leetcode.cn/problems/sum-of-all-subset-xor-totals/
第 241 场周赛,构成交替字符串需要的最小交换次数,Minimum Number of Swaps to Make the Binary String Alternating,1600.5573262373,https://leetcode.cn/problems/minimum-number-of-swaps-to-make-the-binary-string-alternating/
第 241 场周赛,找出和为指定值的下标对,Finding Pairs With a Certain Sum,1680.82425993,https://leetcode.cn/problems/finding-pairs-with-a-certain-sum/
第 241 场周赛,恰有 K 根木棍可以看到的排列数目,Number of Ways to Rearrange Sticks With K Sticks Visible,2333.0621537307,https://leetcode.cn/problems/number-of-ways-to-rearrange-sticks-with-k-sticks-visible/
第 52 场双周赛,将句子排序,Sorting the Sentence,1290.0361853035,https://leetcode.cn/problems/sorting-the-sentence/
第 52 场双周赛,增长的内存泄露,Incremental Memory Leak,1387.2941868867,https://leetcode.cn/problems/incremental-memory-leak/
第 52 场双周赛,旋转盒子,Rotating the Box,1536.7018543075,https://leetcode.cn/problems/rotating-the-box/
第 52 场双周赛,向下取整数对和,Sum of Floored Pairs,2170.1079846744,https://leetcode.cn/problems/sum-of-floored-pairs/
第 240 场周赛,人口最多的年份,Maximum Population Year,1370.4186698287,https://leetcode.cn/problems/maximum-population-year/
第 240 场周赛,下标对中的最大距离,Maximum Distance Between a Pair of Values,1514.8181710611,https://leetcode.cn/problems/maximum-distance-between-a-pair-of-values/
第 240 场周赛,子数组最小乘积的最大值,Maximum Subarray Min-Product,2051.0879431258,https://leetcode.cn/problems/maximum-subarray-min-product/
第 240 场周赛,有向图中最大颜色值,Largest Color Value in a Directed Graph,2312.9919953644,https://leetcode.cn/problems/largest-color-value-in-a-directed-graph/
第 239 场周赛,到目标元素的最小距离,Minimum Distance to the Target Element,1216.6376846517,https://leetcode.cn/problems/minimum-distance-to-the-target-element/
第 239 场周赛,将字符串拆分为递减的连续值,Splitting a String Into Descending Consecutive Values,1746.8757919578,https://leetcode.cn/problems/splitting-a-string-into-descending-consecutive-values/
第 239 场周赛,邻位交换的最小次数,Minimum Adjacent Swaps to Reach the Kth Smallest Number,2073.0124645606,https://leetcode.cn/problems/minimum-adjacent-swaps-to-reach-the-kth-smallest-number/
第 239 场周赛,包含每个查询的最小区间,Minimum Interval to Include Each Query,2286.1378742318,https://leetcode.cn/problems/minimum-interval-to-include-each-query/
第 51 场双周赛,将所有数字用字符替换,Replace All Digits with Characters,1300.9041426403,https://leetcode.cn/problems/replace-all-digits-with-characters/
第 51 场双周赛,座位预约管理系统,Seat Reservation Manager,1428.6729861424,https://leetcode.cn/problems/seat-reservation-manager/
第 51 场双周赛,减小和重新排列数组后的最大元素,Maximum Element After Decreasing and Rearranging,1454.3901912166,https://leetcode.cn/problems/maximum-element-after-decreasing-and-rearranging/
第 51 场双周赛,最近的房间,Closest Room,2081.7518764643,https://leetcode.cn/problems/closest-room/
第 238 场周赛,K 进制表示下的各位数字总和,Sum of Digits in Base K,1282.4111853142,https://leetcode.cn/problems/sum-of-digits-in-base-k/
第 238 场周赛,最高频元素的频数,Frequency of the Most Frequent Element,1876.3611046625,https://leetcode.cn/problems/frequency-of-the-most-frequent-element/
第 238 场周赛,所有元音按顺序排布的最长子字符串,Longest Substring Of All Vowels in Order,1580.3620959714,https://leetcode.cn/problems/longest-substring-of-all-vowels-in-order/
第 238 场周赛,最高建筑高度,Maximum Building Height,2374.1850487395,https://leetcode.cn/problems/maximum-building-height/
第 237 场周赛,判断句子是否为全字母句,Check if the Sentence Is Pangram,1166.78818332,https://leetcode.cn/problems/check-if-the-sentence-is-pangram/
第 237 场周赛,雪糕的最大数量,Maximum Ice Cream Bars,1252.7479413966,https://leetcode.cn/problems/maximum-ice-cream-bars/
第 237 场周赛,单线程 CPU,Single-Threaded CPU,1797.7466000366,https://leetcode.cn/problems/single-threaded-cpu/
第 237 场周赛,所有数对按位与结果的异或和,Find XOR Sum of All Pairs Bitwise AND,1825.0056908946,https://leetcode.cn/problems/find-xor-sum-of-all-pairs-bitwise-and/
第 50 场双周赛,最少操作使数组递增,Minimum Operations to Make the Array Increasing,1314.8600143277,https://leetcode.cn/problems/minimum-operations-to-make-the-array-increasing/
第 50 场双周赛,统计一个圆中点的数目,Queries on Number of Points Inside a Circle,1380.0192844155,https://leetcode.cn/problems/queries-on-number-of-points-inside-a-circle/
第 50 场双周赛,每个查询的最大异或值,Maximum XOR for Each Query,1523.4113866454,https://leetcode.cn/problems/maximum-xor-for-each-query/
第 50 场双周赛,使字符串有序的最少操作次数,Minimum Number of Operations to Make String Sorted,2620.4181842249,https://leetcode.cn/problems/minimum-number-of-operations-to-make-string-sorted/
第 236 场周赛,数组元素积的符号,Sign of the Product of an Array,1209.6571020247,https://leetcode.cn/problems/sign-of-the-product-of-an-array/
第 236 场周赛,找出游戏的获胜者,Find the Winner of the Circular Game,1412.3053230205,https://leetcode.cn/problems/find-the-winner-of-the-circular-game/
第 236 场周赛,最少侧跳次数,Minimum Sideway Jumps,1778.4880620629,https://leetcode.cn/problems/minimum-sideway-jumps/
第 236 场周赛,求出 MK 平均值,Finding MK Average,2395.8765531206,https://leetcode.cn/problems/finding-mk-average/
第 235 场周赛,截断句子,Truncate Sentence,1235.6114196155,https://leetcode.cn/problems/truncate-sentence/
第 235 场周赛,查找用户活跃分钟数,Finding the Users Active Minutes,1360.3005775112,https://leetcode.cn/problems/finding-the-users-active-minutes/
第 235 场周赛,绝对差值和,Minimum Absolute Sum Difference,1934.3556201811,https://leetcode.cn/problems/minimum-absolute-sum-difference/
第 235 场周赛,序列中不同最大公约数的数目,Number of Different Subsequences GCDs,2539.863726397,https://leetcode.cn/problems/number-of-different-subsequences-gcds/
第 49 场双周赛,判断国际象棋棋盘中一个格子的颜色,Determine Color of a Chessboard Square,1328.513147726,https://leetcode.cn/problems/determine-color-of-a-chessboard-square/
第 49 场双周赛,句子相似性 III,Sentence Similarity III,1588.9690763997,https://leetcode.cn/problems/sentence-similarity-iii/
第 49 场双周赛,统计一个数组中好对子的数目,Count Nice Pairs in an Array,1737.8431142688,https://leetcode.cn/problems/count-nice-pairs-in-an-array/
第 49 场双周赛,得到新鲜甜甜圈的最多组数,Maximum Number of Groups Getting Fresh Donuts,2559.4351004238,https://leetcode.cn/problems/maximum-number-of-groups-getting-fresh-donuts/
第 234 场周赛,字符串中不同整数的数目,Number of Different Integers in a String,1333.3138174157,https://leetcode.cn/problems/number-of-different-integers-in-a-string/
第 234 场周赛,还原排列的最少操作步数,Minimum Number of Operations to Reinitialize a Permutation,1491.4638194905,https://leetcode.cn/problems/minimum-number-of-operations-to-reinitialize-a-permutation/
第 234 场周赛,替换字符串中的括号内容,Evaluate the Bracket Pairs of a String,1481.960807786,https://leetcode.cn/problems/evaluate-the-bracket-pairs-of-a-string/
第 234 场周赛,好因子的最大数目,Maximize Number of Nice Divisors,2070.2102619334,https://leetcode.cn/problems/maximize-number-of-nice-divisors/
第 233 场周赛,最大升序子数组和,Maximum Ascending Subarray Sum,1229.1709574783,https://leetcode.cn/problems/maximum-ascending-subarray-sum/
第 233 场周赛,积压订单中的订单总数,Number of Orders in the Backlog,1711.1205064321,https://leetcode.cn/problems/number-of-orders-in-the-backlog/
第 233 场周赛,有界数组中指定下标处的最大值,Maximum Value at a Given Index in a Bounded Array,1929.3184180196,https://leetcode.cn/problems/maximum-value-at-a-given-index-in-a-bounded-array/
第 233 场周赛,统计异或值在范围内的数对有多少,Count Pairs With XOR in a Range,2479.3282985529,https://leetcode.cn/problems/count-pairs-with-xor-in-a-range/
第 48 场双周赛,字符串中第二大的数字,Second Largest Digit in a String,1341.8397242604,https://leetcode.cn/problems/second-largest-digit-in-a-string/
第 48 场双周赛,设计一个验证系统,Design Authentication Manager,1534.0648719302,https://leetcode.cn/problems/design-authentication-manager/
第 48 场双周赛,你能构造出连续值的最大数目,Maximum Number of Consecutive Values You Can Make,1931.0849921121,https://leetcode.cn/problems/maximum-number-of-consecutive-values-you-can-make/
第 48 场双周赛,N 次操作后的最大分数和,Maximize Score After N Operations,2072.7264178313,https://leetcode.cn/problems/maximize-score-after-n-operations/
第 232 场周赛,仅执行一次字符串交换能否使两个字符串相等,Check if One String Swap Can Make Strings Equal,1300.8009461582,https://leetcode.cn/problems/check-if-one-string-swap-can-make-strings-equal/
第 232 场周赛,找出星型图的中心节点,Find Center of Star Graph,1286.7934718934,https://leetcode.cn/problems/find-center-of-star-graph/
第 232 场周赛,最大平均通过率,Maximum Average Pass Ratio,1817.9978644712,https://leetcode.cn/problems/maximum-average-pass-ratio/
第 232 场周赛,好子数组的最大分数,Maximum Score of a Good Subarray,1945.7515607928,https://leetcode.cn/problems/maximum-score-of-a-good-subarray/
第 231 场周赛,检查二进制字符串字段,Check if Binary String Has at Most One Segment of Ones,1206.1240971343,https://leetcode.cn/problems/check-if-binary-string-has-at-most-one-segment-of-ones/
第 231 场周赛,构成特定和需要添加的最少元素,Minimum Elements to Add to Form a Given Sum,1432.0967926378,https://leetcode.cn/problems/minimum-elements-to-add-to-form-a-given-sum/
第 231 场周赛,从第一个节点出发到最后一个节点的受限路径数,Number of Restricted Paths From First to Last Node,2078.5417326415,https://leetcode.cn/problems/number-of-restricted-paths-from-first-to-last-node/
第 231 场周赛,使所有区间的异或结果为零,Make the XOR of All Segments Equal to Zero,2640.3824813624,https://leetcode.cn/problems/make-the-xor-of-all-segments-equal-to-zero/
第 47 场双周赛,找到最近的有相同 X 或 Y 坐标的点,Find Nearest Point That Has the Same X or Y Coordinate,1259.5707438932,https://leetcode.cn/problems/find-nearest-point-that-has-the-same-x-or-y-coordinate/
第 47 场双周赛,判断一个数字是否可以表示成三的幂的和,Check if Number is a Sum of Powers of Three,1505.82499953,https://leetcode.cn/problems/check-if-number-is-a-sum-of-powers-of-three/
第 47 场双周赛,所有子字符串美丽值之和,Sum of Beauty of All Substrings,1714.6960124182,https://leetcode.cn/problems/sum-of-beauty-of-all-substrings/
第 47 场双周赛,统计点对的数目,Count Pairs Of Nodes,2457.115574186,https://leetcode.cn/problems/count-pairs-of-nodes/
第 230 场周赛,统计匹配检索规则的物品数量,Count Items Matching a Rule,1174.8589329736,https://leetcode.cn/problems/count-items-matching-a-rule/
第 230 场周赛,最接近目标价格的甜点成本,Closest Dessert Cost,1701.7584658834,https://leetcode.cn/problems/closest-dessert-cost/
第 230 场周赛,通过最少操作次数使数组的和相等,Equal Sum Arrays With Minimum Number of Operations,1850.4091449367,https://leetcode.cn/problems/equal-sum-arrays-with-minimum-number-of-operations/
第 230 场周赛,车队 II,Car Fleet II,2530.6905139914,https://leetcode.cn/problems/car-fleet-ii/
第 229 场周赛,交替合并字符串,Merge Strings Alternately,1166.5264284193,https://leetcode.cn/problems/merge-strings-alternately/
第 229 场周赛,移动所有球到每个盒子所需的最小操作数,Minimum Number of Operations to Move All Balls to Each Box,1294.7724244077,https://leetcode.cn/problems/minimum-number-of-operations-to-move-all-balls-to-each-box/
第 229 场周赛,执行乘法运算的最大分数,Maximum Score from Performing Multiplication Operations,2068.0043466118,https://leetcode.cn/problems/maximum-score-from-performing-multiplication-operations/
第 229 场周赛,由子序列构造的最长回文串的长度,Maximize Palindrome Length From Subsequences,2182.054452981,https://leetcode.cn/problems/maximize-palindrome-length-from-subsequences/
第 46 场双周赛,最长的美好子字符串,Longest Nice Substring,1521.7133617698,https://leetcode.cn/problems/longest-nice-substring/
第 46 场双周赛,通过连接另一个数组的子数组得到一个数组,Form Array by Concatenating Subarrays of Another Array,1588.3835994255,https://leetcode.cn/problems/form-array-by-concatenating-subarrays-of-another-array/
第 46 场双周赛,地图中的最高点,Map of Highest Peak,1782.9801784101,https://leetcode.cn/problems/map-of-highest-peak/
第 46 场双周赛,互质树,Tree of Coprimes,2231.8099102949,https://leetcode.cn/problems/tree-of-coprimes/
第 228 场周赛,生成交替二进制字符串的最少操作数,Minimum Changes To Make Alternating Binary String,1353.629677812,https://leetcode.cn/problems/minimum-changes-to-make-alternating-binary-string/
第 228 场周赛,统计同质子字符串的数目,Count Number of Homogenous Substrings,1490.8990184504,https://leetcode.cn/problems/count-number-of-homogenous-substrings/
第 228 场周赛,袋子里最少数目的球,Minimum Limit of Balls in a Bag,1939.9323330472,https://leetcode.cn/problems/minimum-limit-of-balls-in-a-bag/
第 228 场周赛,一个图中连通三元组的最小度数,Minimum Degree of a Connected Trio in a Graph,2005.2755755378,https://leetcode.cn/problems/minimum-degree-of-a-connected-trio-in-a-graph/
第 227 场周赛,检查数组是否经排序和轮转得到,Check if Array Is Sorted and Rotated,1324.5320836804,https://leetcode.cn/problems/check-if-array-is-sorted-and-rotated/
第 227 场周赛,移除石子的最大得分,Maximum Score From Removing Stones,1487.5826663483,https://leetcode.cn/problems/maximum-score-from-removing-stones/
第 227 场周赛,构造字典序最大的合并字符串,Largest Merge Of Two Strings,1828.6438563573,https://leetcode.cn/problems/largest-merge-of-two-strings/
第 227 场周赛,最接近目标值的子序列和,Closest Subsequence Sum,2363.5096568214,https://leetcode.cn/problems/closest-subsequence-sum/
第 45 场双周赛,唯一元素的和,Sum of Unique Elements,1228.4824438011,https://leetcode.cn/problems/sum-of-unique-elements/
第 45 场双周赛,任意子数组和的绝对值的最大值,Maximum Absolute Sum of Any Subarray,1541.6176288991,https://leetcode.cn/problems/maximum-absolute-sum-of-any-subarray/
第 45 场双周赛,删除字符串两端相同字符后的最短长度,Minimum Length of String After Deleting Similar Ends,1501.6846714598,https://leetcode.cn/problems/minimum-length-of-string-after-deleting-similar-ends/
第 45 场双周赛,最多可以参加的会议数目 II,Maximum Number of Events That Can Be Attended II,2040.5621123027,https://leetcode.cn/problems/maximum-number-of-events-that-can-be-attended-ii/
第 226 场周赛,盒子中小球的最大数量,Maximum Number of Balls in a Box,1277.9987709491,https://leetcode.cn/problems/maximum-number-of-balls-in-a-box/
第 226 场周赛,从相邻元素对还原数组,Restore the Array From Adjacent Pairs,1579.2309881035,https://leetcode.cn/problems/restore-the-array-from-adjacent-pairs/
第 226 场周赛,你能在你最喜欢的那天吃到你最喜欢的糖果吗？,Can You Eat Your Favorite Candy on Your Favorite Day?,1858.9581916885,https://leetcode.cn/problems/can-you-eat-your-favorite-candy-on-your-favorite-day/
第 226 场周赛,回文串分割 IV,Palindrome Partitioning IV,1924.964639491,https://leetcode.cn/problems/palindrome-partitioning-iv/
第 225 场周赛,替换隐藏数字得到的最晚时间,Latest Time by Replacing Hidden Digits,1264.4836883082,https://leetcode.cn/problems/latest-time-by-replacing-hidden-digits/
第 225 场周赛,满足三条件之一需改变的最少字符数,Change Minimum Characters to Satisfy One of Three Conditions,1952.7073399331,https://leetcode.cn/problems/change-minimum-characters-to-satisfy-one-of-three-conditions/
第 225 场周赛,找出第 K 大的异或坐标值,Find Kth Largest XOR Coordinate Value,1671.4657554194,https://leetcode.cn/problems/find-kth-largest-xor-coordinate-value/
第 225 场周赛,放置盒子,Building Boxes,2198.4642973466,https://leetcode.cn/problems/building-boxes/
第 44 场双周赛,找到最高海拔,Find the Highest Altitude,1256.6807087287,https://leetcode.cn/problems/find-the-highest-altitude/
第 44 场双周赛,需要教语言的最少人数,Minimum Number of People to Teach,1983.70440706,https://leetcode.cn/problems/minimum-number-of-people-to-teach/
第 44 场双周赛,解码异或后的排列,Decode XORed Permutation,2024.3797833173,https://leetcode.cn/problems/decode-xored-permutation/
第 44 场双周赛,生成乘积数组的方案数,Count Ways to Make Array With Product,2499.5640490579,https://leetcode.cn/problems/count-ways-to-make-array-with-product/
第 224 场周赛,可以形成最大正方形的矩形数目,Number Of Rectangles That Can Form The Largest Square,1229.4850365142,https://leetcode.cn/problems/number-of-rectangles-that-can-form-the-largest-square/
第 224 场周赛,同积元组,Tuple with Same Product,1530.0343519239,https://leetcode.cn/problems/tuple-with-same-product/
第 224 场周赛,重新排列后的最大子矩阵,Largest Submatrix With Rearrangements,1926.7059583253,https://leetcode.cn/problems/largest-submatrix-with-rearrangements/
第 224 场周赛,猫和老鼠 II,Cat and Mouse II,2849.4841858619,https://leetcode.cn/problems/cat-and-mouse-ii/
第 223 场周赛,解码异或后的数组,Decode XORed Array,1284.4514662456,https://leetcode.cn/problems/decode-xored-array/
第 223 场周赛,交换链表中的节点,Swapping Nodes in a Linked List,1386.9203620297,https://leetcode.cn/problems/swapping-nodes-in-a-linked-list/
第 223 场周赛,执行交换操作后的最小汉明距离,Minimize Hamming Distance After Swap Operations,1892.1600619469,https://leetcode.cn/problems/minimize-hamming-distance-after-swap-operations/
第 223 场周赛,完成所有工作的最短时间,Find Minimum Time to Finish All Jobs,2284.4463940346,https://leetcode.cn/problems/find-minimum-time-to-finish-all-jobs/
第 43 场双周赛,计算力扣银行的钱,Calculate Money in Leetcode Bank,1294.5297034757,https://leetcode.cn/problems/calculate-money-in-leetcode-bank/
第 43 场双周赛,删除子字符串的最大得分,Maximum Score From Removing Substrings,1867.9916069568,https://leetcode.cn/problems/maximum-score-from-removing-substrings/
第 43 场双周赛,构建字典序最大的可行序列,Construct the Lexicographically Largest Valid Sequence,2080.0425875741,https://leetcode.cn/problems/construct-the-lexicographically-largest-valid-sequence/
第 43 场双周赛,重构一棵树的方案数,Number Of Ways To Reconstruct A Tree,3018.4940165727,https://leetcode.cn/problems/number-of-ways-to-reconstruct-a-tree/
第 222 场周赛,卡车上的最大单元数,Maximum Units on a Truck,1309.8100518373,https://leetcode.cn/problems/maximum-units-on-a-truck/
第 222 场周赛,大餐计数,Count Good Meals,1797.8728515982,https://leetcode.cn/problems/count-good-meals/
第 222 场周赛,将数组分成三个子数组的方案数,Ways to Split Array Into Three Subarrays,2078.6986769435,https://leetcode.cn/problems/ways-to-split-array-into-three-subarrays/
第 222 场周赛,得到子序列的最少操作次数,Minimum Operations to Make a Subsequence,2350.9694374861,https://leetcode.cn/problems/minimum-operations-to-make-a-subsequence/
第 221 场周赛,判断字符串的两半是否相似,Determine if String Halves Are Alike,1207.7224406285,https://leetcode.cn/problems/determine-if-string-halves-are-alike/
第 221 场周赛,吃苹果的最大数目,Maximum Number of Eaten Apples,1929.9086934334,https://leetcode.cn/problems/maximum-number-of-eaten-apples/
第 221 场周赛,球会落何处,Where Will the Ball Fall,1764.9170564773,https://leetcode.cn/problems/where-will-the-ball-fall/
