contest,title,english_title,rating,url
第 79 场双周赛,最多单词数的发件人,Sender With Largest Word Count,1346.9594471871,https://leetcode.cn/problems/sender-with-largest-word-count/
第 79 场双周赛,道路的最大总重要性,Maximum Total Importance of Roads,1496.2502937005,https://leetcode.cn/problems/maximum-total-importance-of-roads/
第 79 场双周赛,以组为单位订音乐会的门票,Booking Concert Tickets in Groups,2470.2118194809,https://leetcode.cn/problems/booking-concert-tickets-in-groups/
第 294 场周赛,字母在字符串中的百分比,Percentage of Letter in String,1161.8236318927,https://leetcode.cn/problems/percentage-of-letter-in-string/
第 294 场周赛,装满石头的背包的最大数量,Maximum Bags With Full Capacity of Rocks,1249.2572200035,https://leetcode.cn/problems/maximum-bags-with-full-capacity-of-rocks/
第 294 场周赛,表示一个折线图的最少线段数,Minimum Lines to Represent a Line Chart,1680.866917849,https://leetcode.cn/problems/minimum-lines-to-represent-a-line-chart/
第 294 场周赛,巫师的总力量和,Sum of Total Strength of Wizards,2621.1208072273,https://leetcode.cn/problems/sum-of-total-strength-of-wizards/
第 293 场周赛,移除字母异位词后的结果数组,Find Resultant Array After Removing Anagrams,1294.5800368625,https://leetcode.cn/problems/find-resultant-array-after-removing-anagrams/
第 293 场周赛,不含特殊楼层的最大连续楼层数,Maximum Consecutive Floors Without Special Floors,1332.6187879411,https://leetcode.cn/problems/maximum-consecutive-floors-without-special-floors/
第 293 场周赛,按位与结果大于零的最长组合,Largest Combination With Bitwise AND Greater Than Zero,1642.1446933109,https://leetcode.cn/problems/largest-combination-with-bitwise-and-greater-than-zero/
第 293 场周赛,统计区间中的整数数目,Count Integers in Intervals,2222.4805422748,https://leetcode.cn/problems/count-integers-in-intervals/
第 78 场双周赛,找到一个数字的 K 美丽值,Find the K-Beauty of a Number,1279.7894769956,https://leetcode.cn/problems/find-the-k-beauty-of-a-number/
第 78 场双周赛,分割数组的方案数,Number of Ways to Split Array,1334.0516779626,https://leetcode.cn/problems/number-of-ways-to-split-array/
第 78 场双周赛,毯子覆盖的最多白色砖块数,Maximum White Tiles Covered by a Carpet,2021.7790710467,https://leetcode.cn/problems/maximum-white-tiles-covered-by-a-carpet/
第 78 场双周赛,最大波动的子字符串,Substring With Largest Variance,2515.7520586008,https://leetcode.cn/problems/substring-with-largest-variance/
第 292 场周赛,字符串中最大的 3 位相同数字,Largest 3-Same-Digit Number in String,1308.948547975,https://leetcode.cn/problems/largest-3-same-digit-number-in-string/
第 292 场周赛,统计值等于子树平均值的节点数,Count Nodes Equal to Average of Subtree,1472.7864965062,https://leetcode.cn/problems/count-nodes-equal-to-average-of-subtree/
第 292 场周赛,统计打字方案数,Count Number of Texts,1856.8610192187,https://leetcode.cn/problems/count-number-of-texts/
第 292 场周赛,检查是否有合法括号字符串路径, Check if There Is a Valid Parentheses String Path,2084.5752686737,https://leetcode.cn/problems/check-if-there-is-a-valid-parentheses-string-path/
第 291 场周赛,移除指定数字得到的最大结果,Remove Digit From Number to Maximize Result,1331.5287857686,https://leetcode.cn/problems/remove-digit-from-number-to-maximize-result/
第 291 场周赛,必须拿起的最小连续卡牌数,Minimum Consecutive Cards to Pick Up,1364.6787168645,https://leetcode.cn/problems/minimum-consecutive-cards-to-pick-up/
第 291 场周赛,含最多 K 个可整除元素的子数组,K Divisible Elements Subarrays,1724.394164934,https://leetcode.cn/problems/k-divisible-elements-subarrays/
第 291 场周赛,字符串的总引力,Total Appeal of A String,2033.1699277531,https://leetcode.cn/problems/total-appeal-of-a-string/
第 77 场双周赛,统计是给定字符串前缀的字符串数目,Count Prefixes of a Given String,1260.870208308,https://leetcode.cn/problems/count-prefixes-of-a-given-string/
第 77 场双周赛,最小平均差,Minimum Average Difference,1394.9149882274,https://leetcode.cn/problems/minimum-average-difference/
第 77 场双周赛,统计网格图中没有被保卫的格子数,Count Unguarded Cells in the Grid,1708.7056764058,https://leetcode.cn/problems/count-unguarded-cells-in-the-grid/
第 77 场双周赛,逃离火灾,Escape the Spreading Fire,2346.5717839654,https://leetcode.cn/problems/escape-the-spreading-fire/
第 290 场周赛,多个数组求交集,Intersection of Multiple Arrays,1264.4778916192,https://leetcode.cn/problems/intersection-of-multiple-arrays/
第 290 场周赛,统计圆内格点数目,Count Lattice Points Inside a Circle,1602.7242171967,https://leetcode.cn/problems/count-lattice-points-inside-a-circle/
第 290 场周赛,统计包含每个点的矩形数目,Count Number of Rectangles Containing Each Point,1997.7013718153,https://leetcode.cn/problems/count-number-of-rectangles-containing-each-point/
第 290 场周赛,花期内花的数目,Number of Flowers in Full Bloom,2022.3137128296,https://leetcode.cn/problems/number-of-flowers-in-full-bloom/
第 289 场周赛,计算字符串的数字和,Calculate Digit Sum of a String,1301.9432665133,https://leetcode.cn/problems/calculate-digit-sum-of-a-string/
第 289 场周赛,完成所有任务需要的最少轮数,Minimum Rounds to Complete All Tasks,1371.8092952004,https://leetcode.cn/problems/minimum-rounds-to-complete-all-tasks/
第 289 场周赛,转角路径的乘积中最多能有几个尾随零,Maximum Trailing Zeros in a Cornered Path,2036.7410194704,https://leetcode.cn/problems/maximum-trailing-zeros-in-a-cornered-path/
第 289 场周赛,相邻字符不同的最长路径,Longest Path With Different Adjacent Characters,2126.3922279277,https://leetcode.cn/problems/longest-path-with-different-adjacent-characters/
第 76 场双周赛,找到最接近 0 的数字,Find Closest Number to Zero,1256.0514740971,https://leetcode.cn/problems/find-closest-number-to-zero/
第 76 场双周赛,买钢笔和铅笔的方案数,Number of Ways to Buy Pens and Pencils,1399.8468905274,https://leetcode.cn/problems/number-of-ways-to-buy-pens-and-pencils/
第 76 场双周赛,设计一个 ATM 机器,Design an ATM Machine,1616.2067360638,https://leetcode.cn/problems/design-an-atm-machine/
第 76 场双周赛,节点序列的最大得分,Maximum Score of a Node Sequence,2304.3094138939,https://leetcode.cn/problems/maximum-score-of-a-node-sequence/
招商银行专场竞赛,文本编辑程序设计,文本编辑程序设计,-1,https://leetcode.cn/problems/fWcPGC/
招商银行专场竞赛,公园规划,公园规划,-1,https://leetcode.cn/problems/ReWLAw/
招商银行专场竞赛,点燃木棒,点燃木棒,-1,https://leetcode.cn/problems/Dk2Ytp/
招商银行专场竞赛,商店促销活动,商店促销活动,-1,https://leetcode.cn/problems/OK3hsO/
第 288 场周赛,按奇偶性交换后的最大数字,Largest Number After Digit Swaps by Parity,1365.2269076492,https://leetcode.cn/problems/largest-number-after-digit-swaps-by-parity/
第 288 场周赛,向表达式添加括号后的最小结果,Minimize Result by Adding Parentheses to Expression,1611.8434720083,https://leetcode.cn/problems/minimize-result-by-adding-parentheses-to-expression/
第 288 场周赛,K 次增加后的最大乘积,Maximum Product After K Increments,1685.5389350949,https://leetcode.cn/problems/maximum-product-after-k-increments/
第 288 场周赛,花园的最大总美丽值,Maximum Total Beauty of the Gardens,2561.508149216,https://leetcode.cn/problems/maximum-total-beauty-of-the-gardens/
第 287 场周赛,转化时间需要的最少操作数,Minimum Number of Operations to Convert Time,1295.8868965907,https://leetcode.cn/problems/minimum-number-of-operations-to-convert-time/
第 287 场周赛,找出输掉零场或一场比赛的玩家,Find Players With Zero or One Losses,1316.2046992429,https://leetcode.cn/problems/find-players-with-zero-or-one-losses/
第 287 场周赛,每个小孩最多能分到多少糖果,Maximum Candies Allocated to K Children,1646.1765343383,https://leetcode.cn/problems/maximum-candies-allocated-to-k-children/
第 287 场周赛,加密解密字符串,Encrypt and Decrypt Strings,1944.5673996888,https://leetcode.cn/problems/encrypt-and-decrypt-strings/
第 75 场双周赛,转换数字的最少位翻转次数,Minimum Bit Flips to Convert Number,1282.1502428906,https://leetcode.cn/problems/minimum-bit-flips-to-convert-number/
第 75 场双周赛,数组的三角和,Find Triangular Sum of an Array,1317.2976846981,https://leetcode.cn/problems/find-triangular-sum-of-an-array/
第 75 场双周赛,选择建筑的方案数,Number of Ways to Select Buildings,1656.5588918365,https://leetcode.cn/problems/number-of-ways-to-select-buildings/
第 75 场双周赛,构造字符串的总得分和,Sum of Scores of Built Strings,2220.0903365738,https://leetcode.cn/problems/sum-of-scores-of-built-strings/
第 286 场周赛,找出两数组的不同,Find the Difference of Two Arrays,1207.748239075,https://leetcode.cn/problems/find-the-difference-of-two-arrays/
第 286 场周赛,美化数组的最少删除数,Minimum Deletions to Make Array Beautiful,1509.5562928491,https://leetcode.cn/problems/minimum-deletions-to-make-array-beautiful/
第 286 场周赛,找到指定长度的回文数,Find Palindrome With Fixed Length,1822.1301265412,https://leetcode.cn/problems/find-palindrome-with-fixed-length/
第 286 场周赛,从栈中取出 K 个硬币的最大面值和,Maximum Value of K Coins From Piles,2157.5814371481,https://leetcode.cn/problems/maximum-value-of-k-coins-from-piles/
第 285 场周赛,统计数组中峰和谷的数量,Count Hills and Valleys in an Array,1354.5231125217,https://leetcode.cn/problems/count-hills-and-valleys-in-an-array/
第 285 场周赛,统计道路上的碰撞次数,Count Collisions on a Road,1581.4963716166,https://leetcode.cn/problems/count-collisions-on-a-road/
第 285 场周赛,射箭比赛中的最大得分,Maximum Points in an Archery Competition,1868.9864493463,https://leetcode.cn/problems/maximum-points-in-an-archery-competition/
第 285 场周赛,由单个字符重复的最长子字符串,Longest Substring of One Repeating Character,2628.7957821141,https://leetcode.cn/problems/longest-substring-of-one-repeating-character/
第 74 场双周赛,将数组划分成相等数对,Divide Array Into Equal Pairs,1223.406570396,https://leetcode.cn/problems/divide-array-into-equal-pairs/
第 74 场双周赛,字符串中最多数目的子字符串,Maximize Number of Subsequences in a String,1550.4297615307,https://leetcode.cn/problems/maximize-number-of-subsequences-in-a-string/
第 74 场双周赛,将数组和减半的最少操作次数,Minimum Operations to Halve Array Sum,1550.0978082682,https://leetcode.cn/problems/minimum-operations-to-halve-array-sum/
第 74 场双周赛,用地毯覆盖后的最少白色砖块,Minimum White Tiles After Covering With Carpets,2105.8582288624,https://leetcode.cn/problems/minimum-white-tiles-after-covering-with-carpets/
中国银联专场竞赛,回文链表,回文链表,-1,https://leetcode.cn/problems/D7rekZ/
中国银联专场竞赛,优惠活动系统,优惠活动系统,-1,https://leetcode.cn/problems/kDPV0f/
中国银联专场竞赛,理财产品,理财产品,-1,https://leetcode.cn/problems/I4mOGz/
中国银联专场竞赛,合作开发,合作开发,-1,https://leetcode.cn/problems/lCh58I/
第 284 场周赛,找出数组中的所有 K 近邻下标,Find All K-Distant Indices in an Array,1266.341468955,https://leetcode.cn/problems/find-all-k-distant-indices-in-an-array/
第 284 场周赛,统计可以提取的工件,Count Artifacts That Can Be Extracted,1525.2146106195,https://leetcode.cn/problems/count-artifacts-that-can-be-extracted/
第 284 场周赛,K 次操作后最大化顶端元素,Maximize the Topmost Element After K Moves,1716.9721777,https://leetcode.cn/problems/maximize-the-topmost-element-after-k-moves/
第 284 场周赛,得到要求路径的最小带权子图,Minimum Weighted Subgraph With the Required Paths,2364.3455634374,https://leetcode.cn/problems/minimum-weighted-subgraph-with-the-required-paths/
第 283 场周赛,Excel 表中某个范围内的单元格,Cells in a Range on an Excel Sheet,1253.1463945043,https://leetcode.cn/problems/cells-in-a-range-on-an-excel-sheet/
第 283 场周赛,向数组中追加 K 个整数,Append K Integers With Minimal Sum,1658.921022733,https://leetcode.cn/problems/append-k-integers-with-minimal-sum/
第 283 场周赛,根据描述创建二叉树,Create Binary Tree From Descriptions,1643.5283095007,https://leetcode.cn/problems/create-binary-tree-from-descriptions/
第 283 场周赛,替换数组中的非互质数,Replace Non-Coprime Numbers in Array,2057.4788263111,https://leetcode.cn/problems/replace-non-coprime-numbers-in-array/
第 73 场双周赛,数组中紧跟 key 之后出现最频繁的数字,Most Frequent Number Following Key In an Array,1289.1912178611,https://leetcode.cn/problems/most-frequent-number-following-key-in-an-array/
第 73 场双周赛,将杂乱无章的数字排序,Sort the Jumbled Numbers,1496.1462748679,https://leetcode.cn/problems/sort-the-jumbled-numbers/
第 73 场双周赛,有向无环图中一个节点的所有祖先,All Ancestors of a Node in a Directed Acyclic Graph,1787.8550568757,https://leetcode.cn/problems/all-ancestors-of-a-node-in-a-directed-acyclic-graph/
第 73 场双周赛,得到回文串的最少操作次数,Minimum Number of Moves to Make Palindrome,2090.6800569319,https://leetcode.cn/problems/minimum-number-of-moves-to-make-palindrome/
第 282 场周赛,统计包含给定前缀的字符串,Counting Words With a Given Prefix,1167.1241589729,https://leetcode.cn/problems/counting-words-with-a-given-prefix/
第 282 场周赛,使两字符串互为字母异位词的最少步骤数,Minimum Number of Steps to Make Two Strings Anagram II,1253.1107481745,https://leetcode.cn/problems/minimum-number-of-steps-to-make-two-strings-anagram-ii/
第 282 场周赛,完成旅途的最少时间,Minimum Time to Complete Trips,1640.9591585343,https://leetcode.cn/problems/minimum-time-to-complete-trips/
第 282 场周赛,完成比赛的最少时间,Minimum Time to Finish the Race,2315.0547336936,https://leetcode.cn/problems/minimum-time-to-finish-the-race/
第 281 场周赛,统计各位数字之和为偶数的整数个数,Count Integers With Even Digit Sum,1257.1166915286,https://leetcode.cn/problems/count-integers-with-even-digit-sum/
第 281 场周赛,合并零之间的节点,Merge Nodes in Between Zeros,1333.192050397,https://leetcode.cn/problems/merge-nodes-in-between-zeros/
第 281 场周赛,构造限制重复的字符串,Construct String With Repeat Limit,1680.1353258588,https://leetcode.cn/problems/construct-string-with-repeat-limit/
第 281 场周赛,统计可以被 K 整除的下标对数目,Count Array Pairs Divisible by K,2246.0452639352,https://leetcode.cn/problems/count-array-pairs-divisible-by-k/
第 72 场双周赛,统计数组中相等且可以被整除的数对,Count Equal and Divisible Pairs in an Array,1215.7827321325,https://leetcode.cn/problems/count-equal-and-divisible-pairs-in-an-array/
第 72 场双周赛,找到和为给定整数的三个连续整数,Find Three Consecutive Integers That Sum to a Given Number,1257.1556875655,https://leetcode.cn/problems/find-three-consecutive-integers-that-sum-to-a-given-number/
第 72 场双周赛,拆分成最多数目的正偶数之和,Maximum Split of Positive Even Integers,1538.233149704,https://leetcode.cn/problems/maximum-split-of-positive-even-integers/
第 72 场双周赛,统计数组中好三元组数目,Count Good Triplets in an Array,2272.4412003208,https://leetcode.cn/problems/count-good-triplets-in-an-array/
第 280 场周赛,得到 0 的操作数,Count Operations to Obtain Zero,1199.8592887103,https://leetcode.cn/problems/count-operations-to-obtain-zero/
第 280 场周赛,使数组变成交替数组的最少操作数,Minimum Operations to Make the Array Alternating,1662.6673692545,https://leetcode.cn/problems/minimum-operations-to-make-the-array-alternating/
第 280 场周赛,拿出最少数目的魔法豆,Removing Minimum Number of Magic Beans,1748.1339100823,https://leetcode.cn/problems/removing-minimum-number-of-magic-beans/
第 280 场周赛,数组的最大与和,Maximum AND Sum of Array,2392.0799451298,https://leetcode.cn/problems/maximum-and-sum-of-array/
第 279 场周赛,对奇偶下标分别排序,Sort Even and Odd Indices Independently,1252.8406166148,https://leetcode.cn/problems/sort-even-and-odd-indices-independently/
第 279 场周赛,重排数字的最小值,Smallest Value of the Rearranged Number,1361.5824742947,https://leetcode.cn/problems/smallest-value-of-the-rearranged-number/
第 279 场周赛,设计位集,Design Bitset,1751.5101577001,https://leetcode.cn/problems/design-bitset/
第 279 场周赛,移除所有载有违禁货物车厢所需的最少时间,Minimum Time to Remove All Cars Containing Illegal Goods,2219.3465296423,https://leetcode.cn/problems/minimum-time-to-remove-all-cars-containing-illegal-goods/
第 71 场双周赛,拆分数位后四位数字的最小和,Minimum Sum of Four Digit Number After Splitting Digits,1314.2912238536,https://leetcode.cn/problems/minimum-sum-of-four-digit-number-after-splitting-digits/
第 71 场双周赛,根据给定数字划分数组,Partition Array According to Given Pivot,1337.6115578703,https://leetcode.cn/problems/partition-array-according-to-given-pivot/
第 71 场双周赛,设置时间的最少代价,Minimum Cost to Set Cooking Time,1851.7255023016,https://leetcode.cn/problems/minimum-cost-to-set-cooking-time/
第 71 场双周赛,删除元素后和的最小差值,Minimum Difference in Sums After Removal of Elements,2225.3877535768,https://leetcode.cn/problems/minimum-difference-in-sums-after-removal-of-elements/
第 278 场周赛,将找到的值乘以 2,Keep Multiplying Found Values by Two,1235.8413685224,https://leetcode.cn/problems/keep-multiplying-found-values-by-two/
第 278 场周赛,分组得分最高的所有下标,All Divisions With the Highest Score of a Binary Array,1390.5023027273,https://leetcode.cn/problems/all-divisions-with-the-highest-score-of-a-binary-array/
第 278 场周赛,查找给定哈希值的子串,Find Substring With Given Hash Value,2062.9876807625,https://leetcode.cn/problems/find-substring-with-given-hash-value/
第 278 场周赛,字符串分组,Groups of Strings,2499.3282271507,https://leetcode.cn/problems/groups-of-strings/
第 277 场周赛,元素计数,Count Elements With Strictly Smaller and Greater Elements ,1201.8730954169,https://leetcode.cn/problems/count-elements-with-strictly-smaller-and-greater-elements/
第 277 场周赛,按符号重排数组,Rearrange Array Elements by Sign,1235.9216009709,https://leetcode.cn/problems/rearrange-array-elements-by-sign/
第 277 场周赛,找出数组中的所有孤独数字,Find All Lonely Numbers in the Array,1275.6108152653,https://leetcode.cn/problems/find-all-lonely-numbers-in-the-array/
第 277 场周赛,基于陈述统计最多好人数,Maximum Good People Based on Statements,1979.9454101467,https://leetcode.cn/problems/maximum-good-people-based-on-statements/
第 70 场双周赛,打折购买糖果的最小开销,Minimum Cost of Buying Candies With Discount,1260.9112824221,https://leetcode.cn/problems/minimum-cost-of-buying-candies-with-discount/
第 70 场双周赛,统计隐藏数组数目,Count the Hidden Sequences,1614.4877804672,https://leetcode.cn/problems/count-the-hidden-sequences/
第 70 场双周赛,价格范围内最高排名的 K 样物品,K Highest Ranked Items Within a Price Range,1836.5345744332,https://leetcode.cn/problems/k-highest-ranked-items-within-a-price-range/
第 70 场双周赛,分隔长廊的方案数,Number of Ways to Divide a Long Corridor,1914.6717285348,https://leetcode.cn/problems/number-of-ways-to-divide-a-long-corridor/
第 276 场周赛,将字符串拆分为若干长度为 k 的组,Divide a String Into Groups of Size k,1273.046473797,https://leetcode.cn/problems/divide-a-string-into-groups-of-size-k/
第 276 场周赛,得到目标值的最少行动次数,Minimum Moves to Reach Target Score,1417.3934930077,https://leetcode.cn/problems/minimum-moves-to-reach-target-score/
第 276 场周赛,解决智力问题,Solving Questions With Brainpower,1709.1054732427,https://leetcode.cn/problems/solving-questions-with-brainpower/
第 276 场周赛,同时运行 N 台电脑的最长时间,Maximum Running Time of N Computers,2265.2118886972,https://leetcode.cn/problems/maximum-running-time-of-n-computers/
第 275 场周赛,检查是否每一行每一列都包含全部整数,Check if Every Row and Column Contains All Numbers,1264.2868345638,https://leetcode.cn/problems/check-if-every-row-and-column-contains-all-numbers/
第 275 场周赛,最少交换次数来组合所有的 1 II,Minimum Swaps to Group All 1's Together II,1748.4522689101,https://leetcode.cn/problems/minimum-swaps-to-group-all-1s-together-ii/
第 275 场周赛,统计追加字母可以获得的单词数,Count Words Obtained After Adding a Letter,1828.2700238306,https://leetcode.cn/problems/count-words-obtained-after-adding-a-letter/
第 275 场周赛,全部开花的最早一天,Earliest Possible Day of Full Bloom,2033.4597721985,https://leetcode.cn/problems/earliest-possible-day-of-full-bloom/
第 69 场双周赛,将标题首字母大写,Capitalize the Title,1274.881752217,https://leetcode.cn/problems/capitalize-the-title/
第 69 场双周赛,链表最大孪生和,Maximum Twin Sum of a Linked List,1317.9207508583,https://leetcode.cn/problems/maximum-twin-sum-of-a-linked-list/
第 69 场双周赛,连接两字母单词得到的最长回文串,Longest Palindrome by Concatenating Two Letter Words,1556.8824239708,https://leetcode.cn/problems/longest-palindrome-by-concatenating-two-letter-words/
第 69 场双周赛,用邮票贴满网格图,Stamping the Grid,2364.3930657709,https://leetcode.cn/problems/stamping-the-grid/
第 274 场周赛,检查是否所有 A 都在 B 之前,Check if All A's Appears Before All B's,1201.7686271329,https://leetcode.cn/problems/check-if-all-as-appears-before-all-bs/
第 274 场周赛,银行中的激光束数量,Number of Laser Beams in a Bank,1280.2203734882,https://leetcode.cn/problems/number-of-laser-beams-in-a-bank/
第 274 场周赛,摧毁小行星,Destroying Asteroids,1334.5708444649,https://leetcode.cn/problems/destroying-asteroids/
第 274 场周赛,参加会议的最多员工数,Maximum Employees to Be Invited to a Meeting,2449.1323757838,https://leetcode.cn/problems/maximum-employees-to-be-invited-to-a-meeting/
第 273 场周赛,反转两次的数字,A Number After a Double Reversal,1187.1344261572,https://leetcode.cn/problems/a-number-after-a-double-reversal/
第 273 场周赛,执行所有后缀指令,Execution of All Suffix Instructions Staying in a Grid,1379.8787648129,https://leetcode.cn/problems/execution-of-all-suffix-instructions-staying-in-a-grid/
第 273 场周赛,相同元素的间隔之和,Intervals Between Identical Elements,1760.9131492436,https://leetcode.cn/problems/intervals-between-identical-elements/
第 273 场周赛,还原原数组,Recover the Original Array,2158.8988728254,https://leetcode.cn/problems/recover-the-original-array/
第 68 场双周赛,句子中的最多单词数,Maximum Number of Words Found in Sentences,1257.323514611,https://leetcode.cn/problems/maximum-number-of-words-found-in-sentences/
第 68 场双周赛,从给定原材料中找到所有可以做出的菜,Find All Possible Recipes from Given Supplies,1678.5871762113,https://leetcode.cn/problems/find-all-possible-recipes-from-given-supplies/
第 68 场双周赛,判断一个括号字符串是否有效,Check if a Parentheses String Can Be Valid,2037.6527962599,https://leetcode.cn/problems/check-if-a-parentheses-string-can-be-valid/
第 68 场双周赛,一个区间内所有数乘积的缩写,Abbreviating the Product of a Range,2476.7727985927,https://leetcode.cn/problems/abbreviating-the-product-of-a-range/
第 272 场周赛,找出数组中的第一个回文字符串,Find First Palindromic String in the Array,1215.7443346869,https://leetcode.cn/problems/find-first-palindromic-string-in-the-array/
第 272 场周赛,向字符串添加空格,Adding Spaces to a String,1315.1890809249,https://leetcode.cn/problems/adding-spaces-to-a-string/
第 272 场周赛,股票平滑下跌阶段的数目,Number of Smooth Descent Periods of a Stock,1408.427592417,https://leetcode.cn/problems/number-of-smooth-descent-periods-of-a-stock/
第 272 场周赛,使数组 K 递增的最少操作次数,Minimum Operations to Make the Array K-Increasing,1940.6002290953,https://leetcode.cn/problems/minimum-operations-to-make-the-array-k-increasing/
第 271 场周赛,环和杆,Rings and Rods,1257.7670945029,https://leetcode.cn/problems/rings-and-rods/
第 271 场周赛,子数组范围和,Sum of Subarray Ranges,1504.2133321504,https://leetcode.cn/problems/sum-of-subarray-ranges/
第 271 场周赛,给植物浇水 II,Watering Plants II,1507.1617507911,https://leetcode.cn/problems/watering-plants-ii/
第 271 场周赛,摘水果,Maximum Fruits Harvested After at Most K Steps,2062.3601158741,https://leetcode.cn/problems/maximum-fruits-harvested-after-at-most-k-steps/
第 67 场双周赛,找到和最大的长度为 K 的子序列,Find Subsequence of Length K With the Largest Sum,1447.0268321102,https://leetcode.cn/problems/find-subsequence-of-length-k-with-the-largest-sum/
第 67 场双周赛,适合打劫银行的日子,Find Good Days to Rob the Bank,1702.4962514406,https://leetcode.cn/problems/find-good-days-to-rob-the-bank/
第 67 场双周赛,引爆最多的炸弹,Detonate the Maximum Bombs,1880.0511044074,https://leetcode.cn/problems/detonate-the-maximum-bombs/
