contest,title,english_title,rating,url
第 170 场周赛,获取你好友已观看的视频,Get Watched Videos by Your Friends,1652.5809810428,https://leetcode.cn/problems/get-watched-videos-by-your-friends/
第 170 场周赛,让字符串成为回文串的最少插入次数,Minimum Insertion Steps to Make a String Palindrome,1786.688543054,https://leetcode.cn/problems/minimum-insertion-steps-to-make-a-string-palindrome/
第 169 场周赛,和为零的 N 个不同整数,Find N Unique Integers Sum up to Zero,1167.1331831913,https://leetcode.cn/problems/find-n-unique-integers-sum-up-to-zero/
第 169 场周赛,两棵二叉搜索树中的所有元素,All Elements in Two Binary Search Trees,1260.1755576607,https://leetcode.cn/problems/all-elements-in-two-binary-search-trees/
第 169 场周赛,跳跃游戏 III,Jump Game III,1396.5448074496,https://leetcode.cn/problems/jump-game-iii/
第 169 场周赛,口算难题,Verbal Arithmetic Puzzle,2250.0454791316,https://leetcode.cn/problems/verbal-arithmetic-puzzle/
第 16 场双周赛,将每个元素替换为右侧最大元素,Replace Elements with Greatest Element on Right Side,1219.4252907184,https://leetcode.cn/problems/replace-elements-with-greatest-element-on-right-side/
第 16 场双周赛,转变数组后最接近目标值的数组和,Sum of Mutated Array Closest to Target,1606.9895296459,https://leetcode.cn/problems/sum-of-mutated-array-closest-to-target/
第 16 场双周赛,层数最深叶子节点的和,Deepest Leaves Sum,1387.9431104106,https://leetcode.cn/problems/deepest-leaves-sum/
第 16 场双周赛,最大得分的路径数目,Number of Paths with Max Score,1853.0880092558,https://leetcode.cn/problems/number-of-paths-with-max-score/
第 168 场周赛,统计位数为偶数的数字,Find Numbers with Even Number of Digits,1139.6630206282,https://leetcode.cn/problems/find-numbers-with-even-number-of-digits/
第 168 场周赛,划分数组为连续数字的集合,Divide Array in Sets of K Consecutive Numbers,1490.2370387981,https://leetcode.cn/problems/divide-array-in-sets-of-k-consecutive-numbers/
第 168 场周赛,子串的最大出现次数,Maximum Number of Occurrences of a Substring,1748.1523771585,https://leetcode.cn/problems/maximum-number-of-occurrences-of-a-substring/
第 168 场周赛,你能从盒子里获得的最大糖果数,Maximum Candies You Can Get from Boxes,1824.829446341,https://leetcode.cn/problems/maximum-candies-you-can-get-from-boxes/
第 167 场周赛,二进制链表转整数,Convert Binary Number in a Linked List to Integer,1151.3534799042,https://leetcode.cn/problems/convert-binary-number-in-a-linked-list-to-integer/
第 167 场周赛,顺次数,Sequential Digits,1373.8113453501,https://leetcode.cn/problems/sequential-digits/
第 167 场周赛,元素和小于等于阈值的正方形的最大边长,Maximum Side Length of a Square with Sum Less than or Equal to Threshold,1734.8208369949,https://leetcode.cn/problems/maximum-side-length-of-a-square-with-sum-less-than-or-equal-to-threshold/
第 167 场周赛,网格中的最短路径,Shortest Path in a Grid with Obstacles Elimination,1967.3284576938,https://leetcode.cn/problems/shortest-path-in-a-grid-with-obstacles-elimination/
第 15 场双周赛,有序数组中出现次数超过25%的元素,Element Appearing More Than 25% In Sorted Array,1179.1495967491,https://leetcode.cn/problems/element-appearing-more-than-25-in-sorted-array/
第 15 场双周赛,删除被覆盖区间,Remove Covered Intervals,1375.0234414965,https://leetcode.cn/problems/remove-covered-intervals/
第 15 场双周赛,字母组合迭代器,Iterator for Combination,1591.4725328821,https://leetcode.cn/problems/iterator-for-combination/
第 15 场双周赛,下降路径最小和  II,Minimum Falling Path Sum II,1697.2356875149,https://leetcode.cn/problems/minimum-falling-path-sum-ii/
第 166 场周赛,整数的各位积和之差,Subtract the Product and Sum of Digits of an Integer,1141.2363999461,https://leetcode.cn/problems/subtract-the-product-and-sum-of-digits-of-an-integer/
第 166 场周赛,用户分组,Group the People Given the Group Size They Belong To,1267.223591366,https://leetcode.cn/problems/group-the-people-given-the-group-size-they-belong-to/
第 166 场周赛,使结果不超过阈值的最小除数,Find the Smallest Divisor Given a Threshold,1541.7840320661,https://leetcode.cn/problems/find-the-smallest-divisor-given-a-threshold/
第 166 场周赛,转化为全零矩阵的最少反转次数,Minimum Number of Flips to Convert Binary Matrix to Zero Matrix,1810.7690062079,https://leetcode.cn/problems/minimum-number-of-flips-to-convert-binary-matrix-to-zero-matrix/
第 165 场周赛,找出井字棋的获胜者,Find Winner on a Tic Tac Toe Game,1336.9494482313,https://leetcode.cn/problems/find-winner-on-a-tic-tac-toe-game/
第 165 场周赛,不浪费原料的汉堡制作方案,Number of Burgers with No Waste of Ingredients,1386.3256313989,https://leetcode.cn/problems/number-of-burgers-with-no-waste-of-ingredients/
第 165 场周赛,统计全为 1 的正方形子矩阵,Count Square Submatrices with All Ones,1613.0429766636,https://leetcode.cn/problems/count-square-submatrices-with-all-ones/
第 165 场周赛,分割回文串 III,Palindrome Partitioning III,1979.1323403633,https://leetcode.cn/problems/palindrome-partitioning-iii/
第 14 场双周赛,十六进制魔术数字,Hexspeak,1384.4078082338,https://leetcode.cn/problems/hexspeak/
第 14 场双周赛,删除区间,Remove Interval,1524.8218282113,https://leetcode.cn/problems/remove-interval/
第 14 场双周赛,删除树节点,Delete Tree Nodes,1732.7813534239,https://leetcode.cn/problems/delete-tree-nodes/
第 14 场双周赛,矩形内船只的数目,Number of Ships in a Rectangle,1997.1824403719,https://leetcode.cn/problems/number-of-ships-in-a-rectangle/
第 164 场周赛,访问所有点的最小时间,Minimum Time Visiting All Points,1302.7005460171,https://leetcode.cn/problems/minimum-time-visiting-all-points/
第 164 场周赛,统计参与通信的服务器,Count Servers that Communicate,1374.574900311,https://leetcode.cn/problems/count-servers-that-communicate/
第 164 场周赛,搜索推荐系统,Search Suggestions System,1573.4042963622,https://leetcode.cn/problems/search-suggestions-system/
第 164 场周赛,停在原地的方案数,Number of Ways to Stay in the Same Place After Some Steps,1854.0126399812,https://leetcode.cn/problems/number-of-ways-to-stay-in-the-same-place-after-some-steps/
第 163 场周赛,二维网格迁移,Shift 2D Grid,1337.3722299775,https://leetcode.cn/problems/shift-2d-grid/
第 163 场周赛,在受污染的二叉树中查找元素,Find Elements in a Contaminated Binary Tree,1439.5656079032,https://leetcode.cn/problems/find-elements-in-a-contaminated-binary-tree/
第 163 场周赛,可被三整除的最大和,Greatest Sum Divisible by Three,1762.0307532652,https://leetcode.cn/problems/greatest-sum-divisible-by-three/
第 163 场周赛,推箱子,Minimum Moves to Move a Box to Their Target Location,2297.105362516,https://leetcode.cn/problems/minimum-moves-to-move-a-box-to-their-target-location/
第 13 场双周赛,加密数字,Encode Number,1561.2655635205,https://leetcode.cn/problems/encode-number/
第 13 场双周赛,最小公共区域,Smallest Common Region,1654.0793660142,https://leetcode.cn/problems/smallest-common-region/
第 13 场双周赛,近义词句子,Synonymous Sentences,1847.2077654978,https://leetcode.cn/problems/synonymous-sentences/
第 13 场双周赛,不相交的握手,Handshakes That Don't Cross,1951.3509259668,https://leetcode.cn/problems/handshakes-that-dont-cross/
第 162 场周赛,奇数值单元格的数目,Cells with Odd Values in a Matrix,1283.4980318021,https://leetcode.cn/problems/cells-with-odd-values-in-a-matrix/
第 162 场周赛,重构 2 行二进制矩阵,Reconstruct a 2-Row Binary Matrix,1505.8669082864,https://leetcode.cn/problems/reconstruct-a-2-row-binary-matrix/
第 162 场周赛,统计封闭岛屿的数目,Number of Closed Islands,1658.7495899767,https://leetcode.cn/problems/number-of-closed-islands/
第 162 场周赛,得分最高的单词集合,Maximum Score Words Formed by Letters,1881.6810367589,https://leetcode.cn/problems/maximum-score-words-formed-by-letters/
第 161 场周赛,交换字符使得字符串相同,Minimum Swaps to Make Strings Equal,1597.0215918551,https://leetcode.cn/problems/minimum-swaps-to-make-strings-equal/
第 161 场周赛,统计「优美子数组」,Count Number of Nice Subarrays,1623.9443250479,https://leetcode.cn/problems/count-number-of-nice-subarrays/
第 161 场周赛,移除无效的括号,Minimum Remove to Make Valid Parentheses,1657.1231739081,https://leetcode.cn/problems/minimum-remove-to-make-valid-parentheses/
第 161 场周赛,检查「好数组」,Check If It Is a Good Array,1983.2319731313,https://leetcode.cn/problems/check-if-it-is-a-good-array/
第 12 场双周赛,力扣排行榜,Design A Leaderboard,1354.1247827015,https://leetcode.cn/problems/design-a-leaderboard/
第 12 场双周赛,数组变换,Array Transformation,1558.1421869292,https://leetcode.cn/problems/array-transformation/
第 12 场双周赛,树的直径,Tree Diameter,1792.076794537,https://leetcode.cn/problems/tree-diameter/
第 12 场双周赛,删除回文子数组,Palindrome Removal,2203.1738850937,https://leetcode.cn/problems/palindrome-removal/
第 160 场周赛,找出给定方程的正整数解,Find Positive Integer Solution for a Given Equation,1404.7016862187,https://leetcode.cn/problems/find-positive-integer-solution-for-a-given-equation/
第 160 场周赛,循环码排列,Circular Permutation in Binary Representation,1774.8764591297,https://leetcode.cn/problems/circular-permutation-in-binary-representation/
第 160 场周赛,串联字符串的最大长度,Maximum Length of a Concatenated String with Unique Characters,1719.945199874,https://leetcode.cn/problems/maximum-length-of-a-concatenated-string-with-unique-characters/
第 160 场周赛,铺瓷砖,Tiling a Rectangle with the Fewest Squares,2241.5199974312,https://leetcode.cn/problems/tiling-a-rectangle-with-the-fewest-squares/
第 159 场周赛,缀点成线,Check If It Is a Straight Line,1247.3198836387,https://leetcode.cn/problems/check-if-it-is-a-straight-line/
第 159 场周赛,删除子文件夹,Remove Sub-Folders from the Filesystem,1544.8261365027,https://leetcode.cn/problems/remove-sub-folders-from-the-filesystem/
第 159 场周赛,替换子串得到平衡字符串,Replace the Substring for Balanced String,1877.8983358307,https://leetcode.cn/problems/replace-the-substring-for-balanced-string/
第 159 场周赛,规划兼职工作,Maximum Profit in Job Scheduling,2022.8520613737,https://leetcode.cn/problems/maximum-profit-in-job-scheduling/
第 11 场双周赛,等差数列中缺失的数字,Missing Number In Arithmetic Progression,1244.317367883,https://leetcode.cn/problems/missing-number-in-arithmetic-progression/
第 11 场双周赛,安排会议日程,Meeting Scheduler,1541.2260256298,https://leetcode.cn/problems/meeting-scheduler/
第 11 场双周赛,抛掷硬币,Toss Strange Coins,1808.5754920785,https://leetcode.cn/problems/toss-strange-coins/
第 11 场双周赛,分享巧克力,Divide Chocolate,2029.1301557536,https://leetcode.cn/problems/divide-chocolate/
第 158 场周赛,分割平衡字符串,Split a String in Balanced Strings,1219.5284561367,https://leetcode.cn/problems/split-a-string-in-balanced-strings/
第 158 场周赛,可以攻击国王的皇后,Queens That Can Attack the King,1391.7243180131,https://leetcode.cn/problems/queens-that-can-attack-the-king/
第 158 场周赛,掷骰子模拟,Dice Roll Simulation,2008.40650791,https://leetcode.cn/problems/dice-roll-simulation/
第 158 场周赛,最大相等频率,Maximum Equal Frequency,2050.715977457,https://leetcode.cn/problems/maximum-equal-frequency/
第 157 场周赛,玩筹码,Minimum Cost to Move Chips to The Same Position,1407.5442381391,https://leetcode.cn/problems/minimum-cost-to-move-chips-to-the-same-position/
第 157 场周赛,最长定差子序列,Longest Arithmetic Subsequence of Given Difference,1597.1931473887,https://leetcode.cn/problems/longest-arithmetic-subsequence-of-given-difference/
第 157 场周赛,黄金矿工,Path with Maximum Gold,1663.2612318917,https://leetcode.cn/problems/path-with-maximum-gold/
第 157 场周赛,统计元音字母序列的数目,Count Vowels Permutation,1729.6074000215,https://leetcode.cn/problems/count-vowels-permutation/
第 10 场双周赛,三个有序数组的交集,Intersection of Three Sorted Arrays,1259.1979660519,https://leetcode.cn/problems/intersection-of-three-sorted-arrays/
第 10 场双周赛,查找两棵二叉搜索树之和,Two Sum BSTs,1389.0328392117,https://leetcode.cn/problems/two-sum-bsts/
第 10 场双周赛,步进数,Stepping Numbers,1674.5365205597,https://leetcode.cn/problems/stepping-numbers/
第 10 场双周赛,验证回文字符串 III,Valid Palindrome III,1753.9062487685,https://leetcode.cn/problems/valid-palindrome-iii/
第 156 场周赛,独一无二的出现次数,Unique Number of Occurrences,1195.7512695571,https://leetcode.cn/problems/unique-number-of-occurrences/
第 156 场周赛,尽可能使字符串相等,Get Equal Substrings Within Budget,1496.9128643588,https://leetcode.cn/problems/get-equal-substrings-within-budget/
第 156 场周赛,删除字符串中的所有相邻重复项 II,Remove All Adjacent Duplicates in String II,1541.5405749918,https://leetcode.cn/problems/remove-all-adjacent-duplicates-in-string-ii/
第 156 场周赛,穿过迷宫的最少移动次数,Minimum Moves to Reach Target with Rotations,2022.4752963768,https://leetcode.cn/problems/minimum-moves-to-reach-target-with-rotations/
第 155 场周赛,最小绝对差,Minimum Absolute Difference,1198.5705825982,https://leetcode.cn/problems/minimum-absolute-difference/
第 155 场周赛,丑数 III,Ugly Number III,2039.110874689,https://leetcode.cn/problems/ugly-number-iii/
第 155 场周赛,交换字符串中的元素,Smallest String With Swaps,1855.4479039876,https://leetcode.cn/problems/smallest-string-with-swaps/
第 155 场周赛,项目管理,Sort Items by Groups Respecting Dependencies,2418.5742747632,https://leetcode.cn/problems/sort-items-by-groups-respecting-dependencies/
第 9 场双周赛,最多可以买到的苹果数量,How Many Apples Can You Put into the Basket,1248.8026990632,https://leetcode.cn/problems/how-many-apples-can-you-put-into-the-basket/
第 9 场双周赛,进击的骑士,Minimum Knight Moves,1722.3088173214,https://leetcode.cn/problems/minimum-knight-moves/
第 9 场双周赛,找出所有行中最小公共元素,Find Smallest Common Element in All Rows,1401.2246983038,https://leetcode.cn/problems/find-smallest-common-element-in-all-rows/
第 9 场双周赛,建造街区的最短时间,Minimum Time to Build Blocks,2250.2578740769,https://leetcode.cn/problems/minimum-time-to-build-blocks/
第 154 场周赛,“气球” 的最大数量,Maximum Number of Balloons,1181.9716216714,https://leetcode.cn/problems/maximum-number-of-balloons/
第 154 场周赛,反转每对括号间的子串,Reverse Substrings Between Each Pair of Parentheses,1485.6550472186,https://leetcode.cn/problems/reverse-substrings-between-each-pair-of-parentheses/
第 154 场周赛,K 次串联后最大子数组之和,K-Concatenation Maximum Sum,1747.6755111029,https://leetcode.cn/problems/k-concatenation-maximum-sum/
第 154 场周赛,查找集群内的关键连接,Critical Connections in a Network,2084.6866916045,https://leetcode.cn/problems/critical-connections-in-a-network/
第 153 场周赛,公交站间的距离,Distance Between Bus Stops,1234.4144116814,https://leetcode.cn/problems/distance-between-bus-stops/
第 153 场周赛,一周中的第几天,Day of the Week,1382.4809893713,https://leetcode.cn/problems/day-of-the-week/
第 153 场周赛,删除一次得到子数组最大和,Maximum Subarray Sum with One Deletion,1799.4635458535,https://leetcode.cn/problems/maximum-subarray-sum-with-one-deletion/
第 153 场周赛,使数组严格递增,Make Array Strictly Increasing,2315.6037017989,https://leetcode.cn/problems/make-array-strictly-increasing/
第 8 场双周赛,统计只含单一字母的子串,Count Substrings with Only One Distinct Letter,1315.4085759361,https://leetcode.cn/problems/count-substrings-with-only-one-distinct-letter/
第 8 场双周赛,前后拼接,Before and After Puzzle,1558.6880035344,https://leetcode.cn/problems/before-and-after-puzzle/
第 8 场双周赛,与目标颜色间的最短距离,Shortest Distance to Target Color,1626.6740430119,https://leetcode.cn/problems/shortest-distance-to-target-color/
第 8 场双周赛,矩阵中 1 的最大数量,Maximum Number of Ones,2366.7099607655,https://leetcode.cn/problems/maximum-number-of-ones/
第 152 场周赛,质数排列,Prime Arrangements,1489.0102202162,https://leetcode.cn/problems/prime-arrangements/
第 152 场周赛,健身计划评估,Diet Plan Performance,1397.7743198793,https://leetcode.cn/problems/diet-plan-performance/
第 152 场周赛,构建回文串检测,Can Make Palindrome from Substring,1848.0912848518,https://leetcode.cn/problems/can-make-palindrome-from-substring/
第 152 场周赛,猜字谜,Number of Valid Words for Each Puzzle,2233.963903408,https://leetcode.cn/problems/number-of-valid-words-for-each-puzzle/
第 151 场周赛,查询无效交易,Invalid Transactions,1658.6836278802,https://leetcode.cn/problems/invalid-transactions/
第 151 场周赛,比较字符串最小字母出现频次,Compare Strings by Frequency of the Smallest Character,1431.6864980883,https://leetcode.cn/problems/compare-strings-by-frequency-of-the-smallest-character/
第 151 场周赛,从链表中删去总和值为零的连续节点,Remove Zero Sum Consecutive Nodes from Linked List,1782.3312212058,https://leetcode.cn/problems/remove-zero-sum-consecutive-nodes-from-linked-list/
第 151 场周赛,餐盘栈,Dinner Plate Stacks,2109.9830154953,https://leetcode.cn/problems/dinner-plate-stacks/
第 7 场双周赛,单行键盘,Single-Row Keyboard,1199.2392672964,https://leetcode.cn/problems/single-row-keyboard/
第 7 场双周赛,设计文件系统,Design File System,1479.0110934646,https://leetcode.cn/problems/design-file-system/
第 7 场双周赛,连接棒材的最低费用,Minimum Cost to Connect Sticks,1481.5701319876,https://leetcode.cn/problems/minimum-cost-to-connect-sticks/
第 7 场双周赛,水资源分配优化,Optimize Water Distribution in a Village,2069.4030284676,https://leetcode.cn/problems/optimize-water-distribution-in-a-village/
第 150 场周赛,拼写单词,Find Words That Can Be Formed by Characters,1205.6698455508,https://leetcode.cn/problems/find-words-that-can-be-formed-by-characters/
第 150 场周赛,最大层内元素和,Maximum Level Sum of a Binary Tree,1249.9086403595,https://leetcode.cn/problems/maximum-level-sum-of-a-binary-tree/
第 150 场周赛,地图分析,As Far from Land as Possible,1666.346990979,https://leetcode.cn/problems/as-far-from-land-as-possible/
第 150 场周赛,按字典序排在最后的子串,Last Substring in Lexicographical Order,1864.0948676111,https://leetcode.cn/problems/last-substring-in-lexicographical-order/
第 149 场周赛,一年中的第几天,Day of the Year,1199.4427635582,https://leetcode.cn/problems/day-of-the-year/
第 149 场周赛,掷骰子等于目标和的方法数,Number of Dice Rolls With Target Sum,1653.7337081336,https://leetcode.cn/problems/number-of-dice-rolls-with-target-sum/
第 149 场周赛,单字符重复子串的最大长度,Swap For Longest Repeated Character Substring,1787.4514432151,https://leetcode.cn/problems/swap-for-longest-repeated-character-substring/
第 149 场周赛,子数组中占绝大多数的元素,Online Majority Element In Subarray,2205.4304373587,https://leetcode.cn/problems/online-majority-element-in-subarray/
第 6 场双周赛,检查一个数是否在数组中占绝大多数,Check If a Number Is Majority Element in a Sorted Array,1249.9947800752,https://leetcode.cn/problems/check-if-a-number-is-majority-element-in-a-sorted-array/
第 6 场双周赛,最少交换次数来组合所有的 1,Minimum Swaps to Group All 1's Together,1508.1169489285,https://leetcode.cn/problems/minimum-swaps-to-group-all-1s-together/
第 6 场双周赛,用户网站访问行为分析,Analyze User Website Visit Pattern,1850.8490524791,https://leetcode.cn/problems/analyze-user-website-visit-pattern/
第 6 场双周赛,字符串转化,String Transforms Into Another String,1949.0920823355,https://leetcode.cn/problems/string-transforms-into-another-string/
第 148 场周赛,递减元素使数组呈锯齿状,Decrease Elements To Make Array Zigzag,1558.7188539503,https://leetcode.cn/problems/decrease-elements-to-make-array-zigzag/
第 148 场周赛,二叉树着色游戏,Binary Tree Coloring Game,1741.4527995252,https://leetcode.cn/problems/binary-tree-coloring-game/
第 148 场周赛,快照数组,Snapshot Array,1770.8924569497,https://leetcode.cn/problems/snapshot-array/
第 148 场周赛,段式回文,Longest Chunked Palindrome Decomposition,1912.0829958001,https://leetcode.cn/problems/longest-chunked-palindrome-decomposition/
第 147 场周赛,第 N 个泰波那契数,N-th Tribonacci Number,1142.8650731632,https://leetcode.cn/problems/n-th-tribonacci-number/
第 147 场周赛,字母板上的路径,Alphabet Board Path,1410.5239927267,https://leetcode.cn/problems/alphabet-board-path/
第 147 场周赛,最大的以 1 为边界的正方形,Largest 1-Bordered Square,1744.0388789755,https://leetcode.cn/problems/largest-1-bordered-square/
第 147 场周赛,石子游戏 II,Stone Game II,2034.9740902393,https://leetcode.cn/problems/stone-game-ii/
第 5 场双周赛,最大唯一数,Largest Unique Number,1226.2960135431,https://leetcode.cn/problems/largest-unique-number/
第 5 场双周赛,阿姆斯特朗数,Armstrong Number,1231.4004525633,https://leetcode.cn/problems/armstrong-number/
第 5 场双周赛,最低成本联通所有城市,Connecting Cities With Minimum Cost,1752.9555725796,https://leetcode.cn/problems/connecting-cities-with-minimum-cost/
第 5 场双周赛,并行课程,Parallel Courses,1710.0787625377,https://leetcode.cn/problems/parallel-courses/
第 146 场周赛,等价多米诺骨牌对的数量,Number of Equivalent Domino Pairs,1332.622596763,https://leetcode.cn/problems/number-of-equivalent-domino-pairs/
第 146 场周赛,颜色交替的最短路径,Shortest Path with Alternating Colors,1779.7534349429,https://leetcode.cn/problems/shortest-path-with-alternating-colors/
第 146 场周赛,叶值的最小代价生成树,Minimum Cost Tree From Leaf Values,1919.1749818083,https://leetcode.cn/problems/minimum-cost-tree-from-leaf-values/
第 146 场周赛,绝对值表达式的最大值,Maximum of Absolute Value Expression,2059.4040623264,https://leetcode.cn/problems/maximum-of-absolute-value-expression/
第 145 场周赛,数组的相对排序,Relative Sort Array,1188.6311093158,https://leetcode.cn/problems/relative-sort-array/
第 145 场周赛,最深叶节点的最近公共祖先,Lowest Common Ancestor of Deepest Leaves,1607.0005715974,https://leetcode.cn/problems/lowest-common-ancestor-of-deepest-leaves/
第 145 场周赛,表现良好的最长时间段,Longest Well-Performing Interval,1908.3866125757,https://leetcode.cn/problems/longest-well-performing-interval/
第 145 场周赛,最小的必要团队,Smallest Sufficient Team,2250.9318291559,https://leetcode.cn/problems/smallest-sufficient-team/
第 4 场双周赛,一月有多少天,Number of Days in a Month,1227.3485530532,https://leetcode.cn/problems/number-of-days-in-a-month/
第 4 场双周赛,删去字符串中的元音,Remove Vowels from a String,1232.8314427996,https://leetcode.cn/problems/remove-vowels-from-a-string/
第 4 场双周赛,子树的最大平均值,Maximum Average Subtree,1361.8801013336,https://leetcode.cn/problems/maximum-average-subtree/
第 4 场双周赛,将数组分成几个递增序列,Divide Array Into Increasing Sequences,1664.7703749741,https://leetcode.cn/problems/divide-array-into-increasing-sequences/
第 144 场周赛,IP 地址无效化,Defanging an IP Address,1084.1319467318,https://leetcode.cn/problems/defanging-an-ip-address/
第 144 场周赛,航班预订统计,Corporate Flight Bookings,1569.7528744586,https://leetcode.cn/problems/corporate-flight-bookings/
第 144 场周赛,删点成林,Delete Nodes And Return Forest,1511.3725353467,https://leetcode.cn/problems/delete-nodes-and-return-forest/
第 144 场周赛,有效括号的嵌套深度,Maximum Nesting Depth of Two Valid Parentheses Strings,1749.4981778209,https://leetcode.cn/problems/maximum-nesting-depth-of-two-valid-parentheses-strings/
第 143 场周赛,分糖果 II,Distribute Candies to People,1287.1053917452,https://leetcode.cn/problems/distribute-candies-to-people/
第 143 场周赛,二叉树寻路,Path In Zigzag Labelled Binary Tree,1544.8391626032,https://leetcode.cn/problems/path-in-zigzag-labelled-binary-tree/
第 143 场周赛,填充书架,Filling Bookcase Shelves,2014.2979320644,https://leetcode.cn/problems/filling-bookcase-shelves/
第 143 场周赛,解析布尔表达式,Parsing A Boolean Expression,1880.4226853663,https://leetcode.cn/problems/parsing-a-boolean-expression/
第 3 场双周赛,小于 K 的两数之和,Two Sum Less Than K,1245.2741257148,https://leetcode.cn/problems/two-sum-less-than-k/
第 3 场双周赛,长度为 K 的无重复字符子串,Find K-Length Substrings With No Repeated Characters,1348.670191438,https://leetcode.cn/problems/find-k-length-substrings-with-no-repeated-characters/
第 3 场双周赛,彼此熟识的最早时间,The Earliest Moment When Everyone Become Friends,1558.4971807039,https://leetcode.cn/problems/the-earliest-moment-when-everyone-become-friends/
第 3 场双周赛,得分最高的路径,Path With Maximum Minimum Value,2011.3542735398,https://leetcode.cn/problems/path-with-maximum-minimum-value/
